{
  "$schema": "https://json-schema.org/draft/2020-12/schema",
  "title": "capability-readiness",
  "type": "object",
  "additionalProperties": false,
  "required": [
    "schema_version",
    "project_id",
    "environment",
    "receipts",
    "usage"
  ],
  "properties": {
    "schema_version": {
      "const": 1
    },
    "project_id": {
      "type": "string",
      "minLength": 1
    },
    "environment": {
      "type": "string",
      "minLength": 1
    },
    "receipts": {
      "type": "array",
      "minItems": 0,
      "items": {
        "type": "object",
        "additionalProperties": false,
        "required": [
          "capability",
          "provider",
          "status",
          "checked_at",
          "expires_at",
          "evidence_refs"
        ],
        "properties": {
          "capability": {
            "type": "string",
            "minLength": 1
          },
          "provider": {
            "type": "string",
            "minLength": 1
          },
          "status": {
            "enum": [
              "PASS",
              "FAIL"
            ]
          },
          "checked_at": {
            "type": "string",
            "format": "date-time"
          },
          "expires_at": {
            "type": "string",
            "format": "date-time"
          },
          "evidence_refs": {
            "type": "array",
            "minItems": 1,
            "items": {
              "type": "object",
              "additionalProperties": false,
              "required": [
                "path",
                "sha256"
              ],
              "properties": {
                "path": {
                  "type": "string",
                  "minLength": 1
                },
                "sha256": {
                  "type": "string",
                  "pattern": "^[a-f0-9]{64}$"
                }
              }
            }
          }
        }
      }
    },
    "usage": {
      "type": "array",
      "minItems": 0,
      "items": {
        "type": "object",
        "additionalProperties": false,
        "required": [
          "capability",
          "provider",
          "build_identity",
          "invocation_refs",
          "output_refs"
        ],
        "properties": {
          "capability": {
            "type": "string",
            "minLength": 1
          },
          "provider": {
            "type": "string",
            "minLength": 1
          },
          "build_identity": {
            "type": "string",
            "minLength": 1
          },
          "invocation_refs": {
            "type": "array",
            "minItems": 1,
            "items": {
              "type": "object",
              "additionalProperties": false,
              "required": [
                "path",
                "sha256"
              ],
              "properties": {
                "path": {
                  "type": "string",
                  "minLength": 1
                },
                "sha256": {
                  "type": "string",
                  "pattern": "^[a-f0-9]{64}$"
                }
              }
            }
          },
          "output_refs": {
            "type": "array",
            "minItems": 1,
            "items": {
              "type": "object",
              "additionalProperties": false,
              "required": [
                "path",
                "sha256"
              ],
              "properties": {
                "path": {
                  "type": "string",
                  "minLength": 1
                },
                "sha256": {
                  "type": "string",
                  "pattern": "^[a-f0-9]{64}$"
                }
              }
            }
          }
        }
      }
    }
  }
}
